{
  "schema_version": 1,
  "ride_id": "synthetic-squeeze-loop-001-baseline",
  "started_at": "2026-07-08T17:00:00Z",
  "policy_config": {
    "severity_threshold": 128,
    "confidence_threshold": 128,
    "min_notice_s": 5,
    "max_notice_s": 15,
    "min_cooldown_s": 15,
    "min_cooldown_m": 75,
    "min_speed_kmh": 4
  },
  "samples": [
    { "t_ms": 0, "speed_cmps": 500, "segment_id": 7 },
    { "t_ms": 1000, "speed_cmps": 500, "segment_id": 7 },
    { "t_ms": 2000, "speed_cmps": 500, "segment_id": 7 },
    { "t_ms": 3000, "speed_cmps": 500, "segment_id": 7 },
    { "t_ms": 4000, "speed_cmps": 500, "segment_id": 7 },
    { "t_ms": 5000, "speed_cmps": 500, "segment_id": 7 },
    { "t_ms": 6000, "speed_cmps": 500, "segment_id": 7 },
    { "t_ms": 7000, "speed_cmps": 500, "segment_id": 7 },
    { "t_ms": 8000, "speed_cmps": 500, "segment_id": 7 },
    { "t_ms": 9000, "speed_cmps": 500, "segment_id": 7 },
    { "t_ms": 10000, "speed_cmps": 500, "segment_id": 7 },
    { "t_ms": 11000, "speed_cmps": 500, "segment_id": 7 },
    { "t_ms": 12000, "speed_cmps": 500, "segment_id": 7 },
    { "t_ms": 13000, "speed_cmps": 500, "segment_id": 7 },
    { "t_ms": 14000, "speed_cmps": 500, "segment_id": 7 },
    { "t_ms": 15000, "speed_cmps": 500, "segment_id": 7 },
    { "t_ms": 16000, "speed_cmps": 500, "segment_id": 7 },
    { "t_ms": 17000, "speed_cmps": 500, "segment_id": 7 },
    { "t_ms": 18000, "speed_cmps": 500, "segment_id": 7 },
    { "t_ms": 19000, "speed_cmps": 500, "segment_id": 7 },
    { "t_ms": 20000, "speed_cmps": 500, "segment_id": 7 }
  ],
  "route_events": [
    { "t_ms": 1000, "event_id": 101, "family": "COMPOSITE_SQUEEZE_ZONE", "segment_id": 7, "severity": 200, "confidence": 220, "reasons_bitmask": 7, "distance_to_start_m": 90, "distance_to_end_m": 210 },
    { "t_ms": 4000, "event_id": 101, "family": "COMPOSITE_SQUEEZE_ZONE", "segment_id": 7, "severity": 200, "confidence": 220, "reasons_bitmask": 7, "distance_to_start_m": 75, "distance_to_end_m": 195 },
    { "t_ms": 8000, "event_id": 101, "family": "COMPOSITE_SQUEEZE_ZONE", "segment_id": 7, "severity": 200, "confidence": 220, "reasons_bitmask": 7, "distance_to_start_m": 55, "distance_to_end_m": 175 },
    { "t_ms": 12000, "event_id": 102, "family": "COMPOSITE_SQUEEZE_ZONE", "segment_id": 8, "severity": 210, "confidence": 230, "reasons_bitmask": 3, "distance_to_start_m": 70, "distance_to_end_m": 150 },
    { "t_ms": 13000, "event_id": 101, "family": "COMPOSITE_SQUEEZE_ZONE", "segment_id": 7, "severity": 200, "confidence": 220, "reasons_bitmask": 7, "distance_to_start_m": 30, "distance_to_end_m": 150 },
    { "t_ms": 16000, "event_id": 101, "family": "COMPOSITE_SQUEEZE_ZONE", "segment_id": 7, "severity": 200, "confidence": 220, "reasons_bitmask": 7, "distance_to_start_m": 15, "distance_to_end_m": 135 },
    { "t_ms": 18000, "event_id": 101, "family": "COMPOSITE_SQUEEZE_ZONE", "segment_id": 7, "severity": 200, "confidence": 220, "reasons_bitmask": 7, "distance_to_start_m": 5, "distance_to_end_m": 125 },
    { "t_ms": 19000, "event_id": 101, "family": "COMPOSITE_SQUEEZE_ZONE", "segment_id": 7, "severity": 200, "confidence": 220, "reasons_bitmask": 7, "distance_to_start_m": 0, "distance_to_end_m": 120 },
    { "t_ms": 20000, "event_id": 102, "family": "COMPOSITE_SQUEEZE_ZONE", "segment_id": 8, "severity": 210, "confidence": 230, "reasons_bitmask": 3, "distance_to_start_m": 30, "distance_to_end_m": 110 }
  ],
  "cue_decisions": [
    { "t_ms": 1000, "type": "NONE", "event_id": 101, "reason_code": 7, "lead_time_s": 18 },
    { "t_ms": 4000, "type": "HEAD_UP", "event_id": 101, "reason_code": 0, "lead_time_s": 15 },
    { "t_ms": 8000, "type": "NONE", "event_id": 101, "reason_code": 8, "lead_time_s": 11 },
    { "t_ms": 12000, "type": "NONE", "event_id": 102, "reason_code": 9, "lead_time_s": 14 },
    { "t_ms": 13000, "type": "NONE", "event_id": 101, "reason_code": 8, "lead_time_s": 6 },
    { "t_ms": 16000, "type": "NONE", "event_id": 101, "reason_code": 6, "lead_time_s": 3 },
    { "t_ms": 18000, "type": "NONE", "event_id": 101, "reason_code": 6, "lead_time_s": 1 },
    { "t_ms": 19000, "type": "NONE", "event_id": 101, "reason_code": 4, "lead_time_s": -1 },
    { "t_ms": 20000, "type": "HEAD_UP", "event_id": 102, "reason_code": 0, "lead_time_s": 6 }
  ],
  "markers": [
    { "t_ms": 19000, "segment_id": 7, "type": "unsafe_here" }
  ],
  "reviews": [
    { "event_id": 101, "outcome": "too_late", "reviewed_at": "2026-07-08T18:05:00Z" }
  ]
}
